mysql> use db
Database changed
mysql> show tables;
+--------------+
| Tables_in_db |
+--------------+
| booktable    |
| customer     |
| emp_dept     |
| employee     |
| employees    |
| issuetable   |
| item_mast    |
| orders       |
| salesman     |
+--------------+
9 rows in set (0.09 sec)

mysql> create table departments(department_id int,name char(40),manager_id int,location_id int);
Query OK, 0 rows affected (0.07 sec)

mysql> insert into departments values(10,'Admin',200,1700);
Query OK, 1 row affected (0.01 sec)

mysql> insert into departments values(20,'Marketing',201,1800);
Query OK, 1 row affected (0.01 sec)

mysql> insert into departments values(20,'Purchasing',114,1700);
Query OK, 1 row affected (0.01 sec)

mysql>
mysql> delete departments where name='Purchasing';
ERROR 1064 (42000): You have an error in your SQL syntax; check the manual that corresponds to your MySQL server version for the right syntax to use near 'where name='Purchasing'' at line 1
mysql> delete from departments where name='Purchasing';
Query OK, 1 row affected (0.01 sec)

mysql> insert into departments values(30,'Purchasing',114,1700);
Query OK, 1 row affected (0.01 sec)

mysql> insert into departments values(0,'HR',203,2400);
Query OK, 1 row affected (0.01 sec)

mysql> delete from departments where name='HR';
Query OK, 1 row affected (0.08 sec)

mysql> insert into departments values(40,'HR',203,2400);
Query OK, 1 row affected (0.00 sec)

mysql> insert into departments values(50,'Shipping',121,1500);
Query OK, 1 row affected (0.00 sec)

mysql> insert into departments values(60,'IT',103,1400);
Query OK, 1 row affected (0.01 sec)

mysql> insert into departments values(70,'Public Relations',204,270
0);
Query OK, 1 row affected (0.01 sec)

mysql> insert into departments values(80,'Sales',145,2500);
Query OK, 1 row affected (0.01 sec)

mysql> insert into departments values(90,'Executive',100,1700);
Query OK, 1 row affected (0.01 sec)

mysql> insert into departments values(100,'Finance',108,1700);
Query OK, 1 row affected (0.01 sec)

mysql> insert into departments values(110,'Accounting',205,1700);
Query OK, 1 row affected (0.01 sec)

mysql> insert into departments values(120,'Treasury',0,1700);
Query OK, 1 row affected (0.01 sec)

mysql> insert into departments values(130,'Corporate Tax',0,1700);
Query OK, 1 row affected (0.01 sec)

mysql> insert into departments values(140,'Control and Credit',0,17
00);
Query OK, 1 row affected (0.01 sec)

mysql> insert into departments values(150,'Shareholder Services',0,
1700);
Query OK, 1 row affected (0.00 sec)

mysql> insert into departments values(160,'Benifits',0,1700);
Query OK, 1 row affected (0.01 sec)

mysql> insert into departments values(170,'Manufacturing',0,1700);
Query OK, 1 row affected (0.01 sec)

mysql> insert into departments values(180,'Construction',0,1700);
Query OK, 1 row affected (0.01 sec)

mysql> insert into departments values(190,'Contracting',0,1700);
Query OK, 1 row affected (0.01 sec)

mysql> insert into departments values(200,'Operations',0,1700);
Query OK, 1 row affected (0.01 sec)

mysql> insert into departments values(210,'IT Supports',0,1700);
Query OK, 1 row affected (0.01 sec)

mysql> insert into departments values(220,'NOC',0,1700);
Query OK, 1 row affected (0.01 sec)

mysql> insert into departments values(230,'IT Helpdesk',0,1700);
Query OK, 1 row affected (0.01 sec)

mysql> insert into departments values(240,'Government Sales',0,1700
);
Query OK, 1 row affected (0.00 sec)

mysql> insert into departments values(250,'Retail Sales',0,1700);
Query OK, 1 row affected (0.01 sec)

mysql> insert into departments values(260,'Recruiting',0,1700);
Query OK, 1 row affected (0.01 sec)

mysql> insert into departments values(270,'Payroll',0,1700);
Query OK, 1 row affected (0.01 sec)

mysql> select * from departments;
+---------------+----------------------+------------+-------------+
| department_id | name                 | manager_id | location_id |
+---------------+----------------------+------------+-------------+
|            10 | Admin                |        200 |        1700 |
|            20 | Marketing            |        201 |        1800 |
|            30 | Purchasing           |        114 |        1700 |
|            40 | HR                   |        203 |        2400 |
|            50 | Shipping             |        121 |        1500 |
|            60 | IT                   |        103 |        1400 |
|            70 | Public Relations     |        204 |        2700 |
|            80 | Sales                |        145 |        2500 |
|            90 | Executive            |        100 |        1700 |
|           100 | Finance              |        108 |        1700 |
|           110 | Accounting           |        205 |        1700 |
|           120 | Treasury             |          0 |        1700 |
|           130 | Corporate Tax        |          0 |        1700 |
|           140 | Control and Credit   |          0 |        1700 |
|           150 | Shareholder Services |          0 |        1700 |
|           160 | Benifits             |          0 |        1700 |
|           170 | Manufacturing        |          0 |        1700 |
|           180 | Construction         |          0 |        1700 |
|           190 | Contracting          |          0 |        1700 |
|           200 | Operations           |          0 |        1700 |
|           210 | IT Supports          |          0 |        1700 |
|           220 | NOC                  |          0 |        1700 |
|           230 | IT Helpdesk          |          0 |        1700 |
|           240 | Government Sales     |          0 |        1700 |
|           250 | Retail Sales         |          0 |        1700 |
|           260 | Recruiting           |          0 |        1700 |
|           270 | Payroll              |          0 |        1700 |
+---------------+----------------------+------------+-------------+
27 rows in set (0.00 sec)

mysql>